{
  "$schema": "https://json-schema.org/draft/2020-12/schema",
  "$id": "https://policypilot.dev/schemas/ruleset-1.0.json",
  "title": "PolicyPilot RuleSet",
  "type": "object",
  "additionalProperties": false,
  "required": [
    "dslVersion",
    "id",
    "name",
    "language",
    "fields",
    "defaults",
    "rules"
  ],
  "properties": {
    "dslVersion": {
      "const": "1.0"
    },
    "id": {
      "type": "string",
      "pattern": "^[a-z0-9]+(-[a-z0-9]+)*$",
      "maxLength": 64
    },
    "name": {
      "type": "string",
      "minLength": 1,
      "maxLength": 120
    },
    "language": {
      "enum": [
        "he",
        "en"
      ]
    },
    "description": {
      "type": "string",
      "maxLength": 2000
    },
    "fields": {
      "type": "array",
      "minItems": 1,
      "maxItems": 100,
      "items": {
        "$ref": "#/$defs/field"
      }
    },
    "defaults": {
      "$ref": "#/$defs/defaults"
    },
    "rules": {
      "type": "array",
      "minItems": 1,
      "maxItems": 500,
      "items": {
        "$ref": "#/$defs/rule"
      }
    }
  },
  "$defs": {
    "identifier": {
      "type": "string",
      "pattern": "^[a-z][a-z0-9_]{0,63}$"
    },
    "literal": {
      "type": [
        "number",
        "string",
        "boolean"
      ]
    },
    "fieldRef": {
      "type": "object",
      "additionalProperties": false,
      "required": [
        "field"
      ],
      "properties": {
        "field": {
          "$ref": "#/$defs/identifier"
        }
      }
    },
    "expression": {
      "anyOf": [
        {
          "type": "number"
        },
        {
          "$ref": "#/$defs/fieldRef"
        },
        {
          "type": "object",
          "additionalProperties": false,
          "required": [
            "fn",
            "args"
          ],
          "properties": {
            "fn": {
              "enum": [
                "add",
                "sub",
                "mul",
                "div",
                "min",
                "max",
                "abs",
                "round",
                "pow",
                "months_between"
              ]
            },
            "args": {
              "type": "array",
              "minItems": 1,
              "maxItems": 8,
              "items": {
                "$ref": "#/$defs/expression"
              }
            }
          }
        }
      ]
    },
    "quotedProvenance": {
      "type": "object",
      "additionalProperties": false,
      "required": [
        "kind",
        "paragraph",
        "quote"
      ],
      "properties": {
        "kind": {
          "const": "quoted"
        },
        "paragraph": {
          "type": "integer",
          "minimum": 1
        },
        "quote": {
          "type": "string",
          "minLength": 3,
          "maxLength": 500
        },
        "confidence": {
          "type": "number",
          "minimum": 0,
          "maximum": 1
        }
      }
    },
    "analystProvenance": {
      "type": "object",
      "additionalProperties": false,
      "required": [
        "kind",
        "note",
        "actor"
      ],
      "properties": {
        "kind": {
          "const": "analyst"
        },
        "note": {
          "type": "string",
          "minLength": 3,
          "maxLength": 500
        },
        "actor": {
          "type": "string",
          "minLength": 1,
          "maxLength": 80
        },
        "changeRequestId": {
          "type": "string",
          "minLength": 1,
          "maxLength": 64
        }
      }
    },
    "pendingProvenance": {
      "type": "object",
      "additionalProperties": false,
      "required": [
        "kind",
        "changeRequestId",
        "rationale"
      ],
      "properties": {
        "kind": {
          "const": "pending"
        },
        "changeRequestId": {
          "type": "string",
          "minLength": 1,
          "maxLength": 64
        },
        "rationale": {
          "type": "string",
          "minLength": 3,
          "maxLength": 500
        }
      }
    },
    "provenance": {
      "oneOf": [
        {
          "$ref": "#/$defs/quotedProvenance"
        },
        {
          "$ref": "#/$defs/analystProvenance"
        },
        {
          "$ref": "#/$defs/pendingProvenance"
        }
      ]
    },
    "field": {
      "type": "object",
      "additionalProperties": false,
      "required": [
        "name",
        "type"
      ],
      "properties": {
        "name": {
          "$ref": "#/$defs/identifier"
        },
        "type": {
          "enum": [
            "number",
            "integer",
            "boolean",
            "string",
            "enum",
            "date"
          ]
        },
        "unit": {
          "type": "string",
          "maxLength": 20
        },
        "values": {
          "type": "array",
          "minItems": 1,
          "maxItems": 50,
          "uniqueItems": true,
          "items": {
            "$ref": "#/$defs/identifier"
          }
        },
        "required": {
          "type": "boolean",
          "default": false
        },
        "derived": {
          "type": "boolean",
          "default": false
        },
        "default": {
          "$ref": "#/$defs/literal"
        },
        "minimum": {
          "type": "number"
        },
        "maximum": {
          "type": "number"
        },
        "exclusiveMinimum": {
          "type": "number"
        },
        "exclusiveMaximum": {
          "type": "number"
        },
        "description": {
          "type": "string",
          "maxLength": 300
        },
        "source": {
          "$ref": "#/$defs/quotedProvenance"
        }
      },
      "allOf": [
        {
          "if": {
            "properties": {
              "type": {
                "const": "enum"
              }
            }
          },
          "then": {
            "required": [
              "values"
            ]
          },
          "else": {
            "not": {
              "required": [
                "values"
              ]
            }
          }
        },
        {
          "if": {
            "properties": {
              "derived": {
                "const": true
              }
            },
            "required": [
              "derived"
            ]
          },
          "then": {
            "properties": {
              "required": {
                "const": false
              }
            },
            "not": {
              "required": [
                "default"
              ]
            }
          }
        }
      ]
    },
    "comparison": {
      "type": "object",
      "additionalProperties": false,
      "required": [
        "field",
        "op"
      ],
      "properties": {
        "field": {
          "$ref": "#/$defs/identifier"
        },
        "op": {
          "enum": [
            "eq",
            "ne",
            "lt",
            "lte",
            "gt",
            "gte",
            "in",
            "not_in",
            "between",
            "matches",
            "present",
            "absent"
          ]
        },
        "value": {
          "anyOf": [
            {
              "$ref": "#/$defs/literal"
            },
            {
              "type": "array",
              "minItems": 1,
              "maxItems": 50,
              "items": {
                "$ref": "#/$defs/literal"
              }
            },
            {
              "$ref": "#/$defs/expression"
            }
          ]
        }
      },
      "allOf": [
        {
          "if": {
            "properties": {
              "op": {
                "enum": [
                  "present",
                  "absent"
                ]
              }
            }
          },
          "then": {
            "not": {
              "required": [
                "value"
              ]
            }
          },
          "else": {
            "required": [
              "value"
            ]
          }
        },
        {
          "if": {
            "properties": {
              "op": {
                "enum": [
                  "in",
                  "not_in",
                  "between"
                ]
              }
            }
          },
          "then": {
            "properties": {
              "value": {
                "type": "array"
              }
            }
          }
        },
        {
          "if": {
            "properties": {
              "op": {
                "const": "between"
              }
            }
          },
          "then": {
            "properties": {
              "value": {
                "type": "array",
                "minItems": 2,
                "maxItems": 2
              }
            }
          }
        },
        {
          "if": {
            "properties": {
              "op": {
                "const": "matches"
              }
            }
          },
          "then": {
            "properties": {
              "value": {
                "type": "string",
                "maxLength": 200
              }
            }
          }
        }
      ]
    },
    "condition": {
      "oneOf": [
        {
          "$ref": "#/$defs/comparison"
        },
        {
          "type": "object",
          "additionalProperties": false,
          "required": [
            "all"
          ],
          "properties": {
            "all": {
              "type": "array",
              "minItems": 1,
              "maxItems": 20,
              "items": {
                "$ref": "#/$defs/condition"
              }
            }
          }
        },
        {
          "type": "object",
          "additionalProperties": false,
          "required": [
            "any"
          ],
          "properties": {
            "any": {
              "type": "array",
              "minItems": 1,
              "maxItems": 20,
              "items": {
                "$ref": "#/$defs/condition"
              }
            }
          }
        },
        {
          "type": "object",
          "additionalProperties": false,
          "required": [
            "not"
          ],
          "properties": {
            "not": {
              "$ref": "#/$defs/condition"
            }
          }
        },
        {
          "type": "object",
          "additionalProperties": false,
          "required": [
            "always"
          ],
          "properties": {
            "always": {
              "const": true
            }
          }
        }
      ]
    },
    "outcome": {
      "enum": [
        "approve",
        "reject",
        "refer"
      ]
    },
    "defaults": {
      "type": "object",
      "additionalProperties": false,
      "required": [
        "outcome",
        "reason"
      ],
      "properties": {
        "outcome": {
          "$ref": "#/$defs/outcome"
        },
        "reason": {
          "type": "string",
          "minLength": 1,
          "maxLength": 300
        }
      }
    },
    "action": {
      "oneOf": [
        {
          "type": "object",
          "additionalProperties": false,
          "required": [
            "type",
            "outcome",
            "reason"
          ],
          "properties": {
            "type": {
              "const": "decide"
            },
            "outcome": {
              "$ref": "#/$defs/outcome"
            },
            "terminal": {
              "type": "boolean",
              "default": true
            },
            "reason": {
              "type": "string",
              "minLength": 1,
              "maxLength": 300
            }
          }
        },
        {
          "type": "object",
          "additionalProperties": false,
          "required": [
            "type",
            "field",
            "value"
          ],
          "properties": {
            "type": {
              "const": "set"
            },
            "field": {
              "$ref": "#/$defs/identifier"
            },
            "value": {
              "anyOf": [
                {
                  "$ref": "#/$defs/literal"
                },
                {
                  "$ref": "#/$defs/expression"
                }
              ]
            }
          }
        },
        {
          "type": "object",
          "additionalProperties": false,
          "required": [
            "type",
            "code",
            "message"
          ],
          "properties": {
            "type": {
              "const": "flag"
            },
            "code": {
              "type": "string",
              "pattern": "^[A-Z][A-Z0-9_]{1,40}$"
            },
            "message": {
              "type": "string",
              "minLength": 1,
              "maxLength": 300
            }
          }
        }
      ]
    },
    "rule": {
      "type": "object",
      "additionalProperties": false,
      "required": [
        "id",
        "label",
        "priority",
        "condition",
        "actions",
        "provenance"
      ],
      "properties": {
        "id": {
          "type": "string",
          "pattern": "^R-[0-9]{2,4}$"
        },
        "label": {
          "type": "string",
          "minLength": 3,
          "maxLength": 160
        },
        "priority": {
          "type": "integer",
          "minimum": 1,
          "maximum": 9999
        },
        "enabled": {
          "type": "boolean",
          "default": true
        },
        "condition": {
          "$ref": "#/$defs/condition"
        },
        "actions": {
          "type": "array",
          "minItems": 1,
          "maxItems": 5,
          "items": {
            "$ref": "#/$defs/action"
          }
        },
        "provenance": {
          "$ref": "#/$defs/provenance"
        },
        "tags": {
          "type": "array",
          "maxItems": 10,
          "uniqueItems": true,
          "items": {
            "type": "string",
            "minLength": 1,
            "maxLength": 40
          }
        }
      }
    }
  }
}